examples/qwen3/configs/a8w8_blockscale_tuned_gemm.csv
gfx,cu_num,M,N,K,libtype,kernelId,splitK,us,kernelName,tflops,bw,errRatio
gfx942,80,2048,1024,4096,ck,0,0,91.6423,a8w8_blockscale_1x128x128_256x128x128x128_16x16_32x32_2x2_8x32x1_8x32x1_1x32x1x8_8_1x1_intrawave_v3,187.47,183.07,0.0
gfx942,80,2048,4096,1024,ck,0,0,109.448,a8w8_blockscale_1x128x128_256x128x128x128_16x16_32x32_2x2_8x32x1_8x32x1_1x32x1x8_8_1x1_intrawave_v3,156.97,210.77,0.0
gfx942,80,2048,4096,4096,ck,0,0,314.994,a8w8_blockscale_1x128x128_256x128x128x128_16x16_32x32_2x2_8x32x1_8x32x1_1x32x1x8_8_1x1_intrawave_v3,218.16,133.16,0.0
gfx942,80,2048,4096,12288,ck,0,0,891.659,a8w8_blockscale_1x128x128_256x128x128x128_16x16_32x32_2x2_8x32x1_8x32x1_1x32x1x8_8_1x1_intrawave_v3,231.21,103.49,0.0
gfx942,80,2048,12288,4096,ck,0,0,873.7886,a8w8_blockscale_1x128x128_256x128x128x128_16x16_32x32_2x2_8x32x1_8x32x1_1x32x1x8_8_1x1_intrawave_v3,235.94,124.8,0.0
